{
  "schema_version": "3.0.0",
  "corpus_id": "phase1-5-p1a-public-corpus-20260729T015100Z-r3",
  "parent_corpus_id": "phase1-5-p1a-public-corpus-20260727T150809Z-r2",
  "supersedes_reason": "r3 rebinding: complete five-evidence bindings; p1a-006 private-bedroom and p1a-025 license conflict quarantined.",
  "status": "CORPUS_R3_VALIDATED",
  "external_evidence_root_id": "public-corpus-20260729T015100Z-r3",
  "source_repository": "Wikimedia Commons public files with exact revision metadata",
  "approved_count": 21,
  "quarantine_count": 8,
  "minimum_required_count": 20,
  "allowed_license_ids": [
    "CC0",
    "Public-Domain",
    "CC-BY-4.0"
  ],
  "privacy_policy": {
    "owner_media": "prohibited"
  },
  "age_policy": {
    "approved_human_presence": [
      "NONE",
      "VISIBLE_DOCUMENTED_ADULT"
    ]
  },
  "required_categories": [
    "city_night",
    "indoor_window",
    "seaside",
    "forest",
    "street",
    "cafe_or_lifestyle_interior",
    "architecture",
    "backlight",
    "side_light",
    "low_light",
    "single_person_full_body",
    "single_person_half_body",
    "portrait_close_up",
    "two_people",
    "no_person",
    "dynamic_action",
    "occlusion",
    "complex_background",
    "minimal_background",
    "strong_color",
    "cool_color",
    "warm_color",
    "symmetry",
    "negative_space"
  ],
  "samples": [
    {
      "sample_id": "p1a-001",
      "title": "File:City at Night (Unsplash).jpg",
      "status": "APPROVED",
      "category_tags": [
        "city_night",
        "complex_background",
        "cool_color",
        "low_light",
        "no_person",
        "street",
        "strong_color"
      ],
      "source": {
        "relative_path": "source/p1a-001.jpg",
        "sha256": "b47a5deb172066a56b68e73fb34a75f08b616bfc58b648155c548bf22c9b2d08",
        "bytes": 11294146,
        "mime": "image/jpeg",
        "representation": "parent_verified_copy",
        "original_url": "https://upload.wikimedia.org/wikipedia/commons/4/46/City_at_Night_%28Unsplash%29.jpg",
        "parent_corpus_id": "phase1-5-p1a-public-corpus-20260726T121500Z",
        "width": 5443,
        "height": 3629
      },
      "sanitized": {
        "relative_path": "sanitized/p1a-001.jpg",
        "format": "JPEG",
        "mime": "image/jpeg",
        "bytes": 5604314,
        "sha256": "bfe997c149457eabd49bedc409ad41d203359a442201e52daa7ade513aab5943",
        "dimensions": [
          5443,
          3629
        ],
        "source_dimensions": [
          5443,
          3629
        ],
        "source_orientation": 1,
        "orientation_normalized": false,
        "crop_applied": false,
        "exif_removed": true,
        "gps_removed": true,
        "device_metadata_removed": true,
        "software_metadata_removed": true
      },
      "source_page": {
        "pageid": 61755081,
        "title": "File:City at Night (Unsplash).jpg",
        "revision_id": 1126197116,
        "revision_timestamp": "2025-12-05T19:20:10Z",
        "canonical_url": "https://commons.wikimedia.org/wiki/File:City_at_Night_(Unsplash).jpg",
        "original_url": "https://upload.wikimedia.org/wikipedia/commons/4/46/City_at_Night_%28Unsplash%29.jpg",
        "mime": "image/jpeg",
        "width": 5443,
        "height": 3629,
        "artist": "Kyle Sudu ksudu94",
        "credit": "https://unsplash.com/photos/Wn1VBR6CMKo\nImage at the Wayback Machine\n\nGallery at the Wayback Machine",
        "attribution": "",
        "commons_api_sha256": "0d65e69b6dc86c9c0bc879bcd8111014af1f1b1ad2eb2a2e906a89008f9ee155",
        "metadata_request_url": "https://commons.wikimedia.org/w/api.php?action=query&format=json&formatversion=2&titles=File%3ACity+at+Night+%28Unsplash%29.jpg&prop=imageinfo%7Crevisions&iiprop=url%7Csize%7Cmime%7Csha1%7Ctimestamp%7Cextmetadata&rvprop=ids%7Ctimestamp&rvlimit=1",
        "metadata_request_final_url": "https://commons.wikimedia.org/w/api.php?action=query&format=json&formatversion=2&titles=File%3ACity+at+Night+%28Unsplash%29.jpg&prop=imageinfo%7Crevisions&iiprop=url%7Csize%7Cmime%7Csha1%7Ctimestamp%7Cextmetadata&rvprop=ids%7Ctimestamp&rvlimit=1",
        "retrieved_utc": "2026-07-27T15:08:09Z"
      },
      "license": {
        "id": "CC0",
        "name": "CC0 1.0 Universal",
        "url": "https://creativecommons.org/publicdomain/zero/1.0/deed.en",
        "attribution": {
          "author": "Kyle Sudu ksudu94",
          "title": "City at Night (Unsplash)",
          "page_url": "https://commons.wikimedia.org/wiki/File:City%20at%20Night%20(Unsplash).jpg",
          "license_name": "CC0 1.0 Universal",
          "license_url": "https://creativecommons.org/publicdomain/zero/1.0/deed.en",
          "modified": "Sanitized derivative created by removal of embedded metadata; visual content not cropped.",
          "recommended_attribution": "Kyle Sudu ksudu94 — File:City at Night (Unsplash).jpg — CC0 1.0 Universal (http://creativecommons.org/publicdomain/zero/1.0/deed.en)"
        }
      },
      "human_review": {
        "status": "APPROVED",
        "review_scope": "public-corpus suitability, human presence, age evidence, privacy and category match",
        "human_presence": "NONE",
        "person_count": 0,
        "full_body_count": 0,
        "age_evidence_basis": "NOT_APPLICABLE",
        "age_evidence": "No human subject is present after visual review.",
        "nonvisual_source": "https://commons.wikimedia.org/wiki/File:City%20at%20Night%20(Unsplash).jpg",
        "no_person": true,
        "note": "No human, minor, private-space content, readable identifier, plate, or address observed."
      },
      "metadata_evidence": [
        {
          "evidence_type": "COMMONS_API",
          "relative_path": "metadata/p1a-001/commons_api.json",
          "bytes": 3575,
          "sha256": "0d65e69b6dc86c9c0bc879bcd8111014af1f1b1ad2eb2a2e906a89008f9ee155"
        },
        {
          "evidence_type": "SOURCE_PAGE_RECORD",
          "relative_path": "metadata/p1a-001/source_page_record.json",
          "bytes": 1357,
          "sha256": "d42f6b6424e89fd67d78454831ecb1c155f011b81b9496655ae1609eeca49493"
        },
        {
          "evidence_type": "LICENSE_EVIDENCE",
          "relative_path": "metadata/p1a-001/license_evidence.json",
          "bytes": 1294,
          "sha256": "984d2d207f967dad999af1752a72a4b53d2ba3df76be68c9df4225cfbf1e664b"
        },
        {
          "evidence_type": "TRANSPORT",
          "relative_path": "metadata/p1a-001/transport.json",
          "bytes": 861,
          "sha256": "401cd66f8a30a17820d0c41b0c5c92125b5bf06b0a956485ce6632d6fcb35543"
        },
        {
          "evidence_type": "MANUAL_VISUAL_REVIEW",
          "relative_path": "metadata/p1a-001/manual_visual_review.json",
          "bytes": 785,
          "sha256": "61d6aa8279168964fe1d7607ebe2e5ebb951a6b6f05b587529085d619d707e32"
        }
      ]
    },
    {
      "sample_id": "p1a-002",
      "title": "File:Kolkata City at night.jpg",
      "status": "APPROVED",
      "category_tags": [
        "city_night",
        "complex_background",
        "low_light",
        "no_person",
        "strong_color"
      ],
      "source": {
        "relative_path": "source/p1a-002.jpg",
        "sha256": "5e2aa816f5bd49ab13a45d6afab3a9c9b9e2584a8aabf5b49e99872fe06f3926",
        "bytes": 3812269,
        "mime": "image/jpeg",
        "representation": "parent_verified_copy",
        "original_url": "https://upload.wikimedia.org/wikipedia/commons/b/b2/Kolkata_City_at_night.jpg",
        "parent_corpus_id": "phase1-5-p1a-public-corpus-20260726T121500Z",
        "width": 4160,
        "height": 3120
      },
      "sanitized": {
        "relative_path": "sanitized/p1a-002.jpg",
        "format": "JPEG",
        "mime": "image/jpeg",
        "bytes": 3540987,
        "sha256": "67fc938c5a1e084e548fc634cb642c64c899d7afc42259fcd3865388f71be4b3",
        "dimensions": [
          4160,
          3120
        ],
        "source_dimensions": [
          4160,
          3120
        ],
        "source_orientation": 1,
        "orientation_normalized": false,
        "crop_applied": false,
        "exif_removed": true,
        "gps_removed": true,
        "device_metadata_removed": true,
        "software_metadata_removed": true
      },
      "source_page": {
        "pageid": 147037152,
        "title": "File:Kolkata City at night.jpg",
        "revision_id": 953285201,
        "revision_timestamp": "2024-11-06T02:58:17Z",
        "canonical_url": "https://commons.wikimedia.org/wiki/File:Kolkata_City_at_night.jpg",
        "original_url": "https://upload.wikimedia.org/wikipedia/commons/b/b2/Kolkata_City_at_night.jpg",
        "mime": "image/jpeg",
        "width": 4160,
        "height": 3120,
        "artist": "XYZ 91973",
        "credit": "Own work",
        "attribution": "",
        "commons_api_sha256": "e57fff6a06f125832b1edc3fb7ad8d59b44ffd505208a6833a2655ec9f062548",
        "metadata_request_url": "https://commons.wikimedia.org/w/api.php?action=query&format=json&formatversion=2&titles=File%3AKolkata+City+at+night.jpg&prop=imageinfo%7Crevisions&iiprop=url%7Csize%7Cmime%7Csha1%7Ctimestamp%7Cextmetadata&rvprop=ids%7Ctimestamp&rvlimit=1",
        "metadata_request_final_url": "https://commons.wikimedia.org/w/api.php?action=query&format=json&formatversion=2&titles=File%3AKolkata+City+at+night.jpg&prop=imageinfo%7Crevisions&iiprop=url%7Csize%7Cmime%7Csha1%7Ctimestamp%7Cextmetadata&rvprop=ids%7Ctimestamp&rvlimit=1",
        "retrieved_utc": "2026-07-27T15:08:09Z"
      },
      "license": {
        "id": "CC0",
        "name": "CC0 1.0 Universal",
        "url": "https://creativecommons.org/publicdomain/zero/1.0/deed.en",
        "attribution": {
          "author": "XYZ 91973",
          "title": "Kolkata City at night",
          "page_url": "https://commons.wikimedia.org/wiki/File:Kolkata%20City%20at%20night.jpg",
          "license_name": "CC0 1.0 Universal",